{
  "traceability_id": "tr_spec_gear_train_v1",
  "requirement_id": "tr_req_gear_train_v1",
  "parameter_table": {
    "module_mm": 2.0,
    "pinion1_teeth": 20,
    "gear1_teeth": 40,
    "pinion2_teeth": 20,
    "gear2_teeth": 100,
    "pinion1_radius_mm": 20.0,
    "gear1_radius_mm": 40.0,
    "pinion2_radius_mm": 20.0,
    "gear2_radius_mm": 100.0,
    "stage1_center_distance_mm": 60.0,
    "stage2_center_distance_mm": 120.0,
    "shaft_A_x_mm": 0.0,
    "shaft_B_x_mm": 60.0,
    "shaft_C_x_mm": 180.0,
    "gear_thickness_mm": 20.0,
    "total_ratio": 10.0,
    "overall_length_mm": 280.0,
    "overall_width_mm": 200.0,
    "overall_height_mm": 60.0
  },
  "constraints": [
    "total_ratio == (gear1_teeth / pinion1_teeth) * (gear2_teeth / pinion2_teeth)",
    "stage1_center_distance_mm == pinion1_radius_mm + gear1_radius_mm",
    "stage2_center_distance_mm == pinion2_radius_mm + gear2_radius_mm",
    "all shaft axes parallel (z)",
    "distinct gear types: spur (stage1) and helical (stage2)",
    "units == mm"
  ],
  "material_candidates": ["Steel_4140", "Aluminum_7075", "PLA_prototype"],
  "manufacturing_profile": "cnc_standard",
  "validation_plan": [
    "dimensions_check",
    "topology_check",
    "unit_consistency",
    "manufacturing_profile_rules",
    "assembly_aabb_interference"
  ],
  "unresolved_risks": [
    "Gear tooth geometry deferred: no 'gear' DSL operation is approved",
    "Helix angle for the helical stage unspecified",
    "Load and torque capacity not validated in this surrogate test"
  ]
}
